<?xml version="1.0" encoding="UTF-8"?>
<dataroot xmlns:od="urn:schemas-microsoft-com:officedata" xmlns:xsi="http://www.w3.org/2001/XMLSchema-instance"  xsi:noNamespaceSchemaLocation="Instruments.xsd" generated="2013-04-22T15:16:07">
<Instruments>
<Instrument>Baritone</Instrument>
<Type>Brass</Type>
</Instruments>
<Instruments>
<Instrument>Bass Clarinet</Instrument>
<Type>Woodwind</Type>
</Instruments>
<Instruments>
<Instrument>Bass Drum</Instrument>
<Type>Percussion</Type>
</Instruments>
<Instruments>
<Instrument>Bassoon</Instrument>
<Type>Woodwind</Type>
</Instruments>
<Instruments>
<Instrument>Castanets</Instrument>
<Type>Percussion</Type>
</Instruments>
<Instruments>
<Instrument>Cello</Instrument>
<Type>String</Type>
</Instruments>
<Instruments>
<Instrument>Chimes</Instrument>
<Type>Percussion</Type>
</Instruments>
<Instruments>
<Instrument>Clarinet</Instrument>
<Type>Woodwind</Type>
</Instruments>
<Instruments>
<Instrument>Contrabassoon</Instrument>
<Type>Woodwind</Type>
</Instruments>
<Instruments>
<Instrument>Cymbals</Instrument>
<Type>Percussion</Type>
</Instruments>
<Instruments>
<Instrument>Double Bass</Instrument>
<Type>String</Type>
</Instruments>
<Instruments>
<Instrument>English Horn</Instrument>
<Type>Woodwind</Type>
</Instruments>
<Instruments>
<Instrument>Euphonium</Instrument>
<Type>Brass</Type>
</Instruments>
<Instruments>
<Instrument>Flute</Instrument>
<Type>Woodwind</Type>
</Instruments>
<Instruments>
<Instrument>French Horn</Instrument>
<Type>Brass</Type>
</Instruments>
<Instruments>
<Instrument>Glockenspiel</Instrument>
<Type>Percussion</Type>
</Instruments>
<Instruments>
<Instrument>Guiro</Instrument>
<Type>Percussion</Type>
</Instruments>
<Instruments>
<Instrument>Harp</Instrument>
<Type>String</Type>
</Instruments>
<Instruments>
<Instrument>Oboe</Instrument>
<Type>Woodwind</Type>
</Instruments>
<Instruments>
<Instrument>Piccolo</Instrument>
<Type>Woodwind</Type>
</Instruments>
<Instruments>
<Instrument>Saxophone</Instrument>
<Type>Woodwind</Type>
</Instruments>
<Instruments>
<Instrument>Snare Drum</Instrument>
<Type>Percussion</Type>
</Instruments>
<Instruments>
<Instrument>Tambourine</Instrument>
<Type>Percussion</Type>
</Instruments>
<Instruments>
<Instrument>Timpani</Instrument>
<Type>Percussion</Type>
</Instruments>
<Instruments>
<Instrument>Triangle</Instrument>
<Type>Percussion</Type>
</Instruments>
<Instruments>
<Instrument>Trombone</Instrument>
<Type>Brass</Type>
</Instruments>
<Instruments>
<Instrument>Trumpet</Instrument>
<Type>Brass</Type>
</Instruments>
<Instruments>
<Instrument>Tuba</Instrument>
<Type>Brass</Type>
</Instruments>
<Instruments>
<Instrument>Viola</Instrument>
<Type>String</Type>
</Instruments>
<Instruments>
<Instrument>Violin</Instrument>
<Type>String</Type>
</Instruments>
<Instruments>
<Instrument>Xylophone</Instrument>
<Type>Percussion</Type>
</Instruments>
</dataroot>
